{
  "format_version": "1.0",
  "project_id": "01965a00-0000-7000-8000-000000000000",
  "domain_classes": [
    {
      "uri": "https://evrepo.example.org/vocab/Investigation",
      "label": "Investigation",
      "comment": "A discrete research effort reported within a reference."
    },
    {
      "uri": "https://evrepo.example.org/vocab/Finding",
      "label": "Finding",
      "comment": "The atomic unit of evidence."
    },
    {
      "uri": "https://evrepo.example.org/vocab/Intervention",
      "label": "Intervention",
      "comment": "A policy, program, practice, or treatment being evaluated."
    },
    {
      "uri": "https://evrepo.example.org/vocab/Outcome",
      "label": "Outcome",
      "comment": "A measured result or endpoint."
    },
    {
      "uri": "https://evrepo.example.org/vocab/EffectEstimate",
      "label": "Effect Estimate",
      "comment": "A quantitative estimate of effect size with associated uncertainty measures."
    },
    {
      "uri": "https://evrepo.example.org/vocab/Context",
      "label": "Context",
      "comment": "The setting and circumstances in which an investigation took place."
    },
    {
      "uri": "https://evrepo.example.org/vocab/Funder",
      "label": "Funder",
      "comment": "An organisation providing financial support."
    },
    {
      "uri": "https://evrepo.example.org/vocab/Implementer",
      "label": "Implementer",
      "comment": "An organisation or entity responsible for delivering an intervention."
    }
  ],
  "properties": [
    {
      "id": "01965a00-0000-7000-8000-a00000000001",
      "identifier": "riskColor",
      "label": "Risk Color",
      "description": "Color code representing the risk level of a finding.",
      "domain_class_uri": "https://evrepo.example.org/vocab/Finding",
      "range_scheme_id": "01965a00-0000-7000-8000-000000000001",
      "range_datatype": null,
      "cardinality": "single",
      "required": false
    }
  ]
}
